{
  "@context": [
    "http://www.w3.org/ns/anno.jsonld",
    "http://iiif.io/api/presentation/3/context.json"
  ],
  "id": "https://404mike.github.io/uv4-manifest/mango/stories/codex-claude.json",
  "type": "AnnotationPage",
  "label": {
    "en": [
      "Paris Street; Rainy Day — Gustave Caillebotte"
    ]
  },
  "items": [
    {
      "id": "https://404mike.github.io/uv4-manifest/mango/stories/codex-claude.json/annotation/chapter_1",
      "type": "Annotation",
      "motivation": "supplementing",
      "label": {
        "en": [
          "A painting to walk into"
        ]
      },
      "summary": {
        "en": [
          "Because of the near life-size scale of the figures, it's a painting one wants to just walk into. This is Paris Street; Rainy Day — Gustave Caillebotte's largest painting."
        ]
      },
      "body": [
        {
          "id": "https://404mike.github.io/uv4-manifest/mango/work/media/paris-street-rainy-day.mp3#t=0,14.13",
          "type": "Sound",
          "format": "audio/mp3",
          "language": "en"
        },
        {
          "type": "TextualBody",
          "format": "application/vnd.mango.story-state+json",
          "value": "{\"storyVersion\":\"1.0\",\"state\":{\"chapterId\":\"chapter_1\",\"canvasIndex\":0,\"canvasId\":\"https://www.artic.edu/iiif/2/f8fd76e9-c396-5678-36ed-6a348c904d27\",\"viewBox\":{\"x\":0,\"y\":0,\"w\":9987,\"h\":7755},\"cameraTrack\":{\"durationMs\":13930,\"keyframes\":[{\"id\":\"a\",\"timeMs\":0,\"focus\":{\"x\":4993.5,\"y\":3877.5},\"viewBox\":{\"x\":0,\"y\":0,\"w\":9987,\"h\":7755}},{\"id\":\"b\",\"timeMs\":13930,\"focus\":{\"x\":5000,\"y\":3889},\"viewBox\":{\"x\":700,\"y\":550,\"w\":8600,\"h\":6678}}],\"preset\":\"custom\",\"pathType\":\"linear\",\"easing\":\"ease-out\"},\"playback\":{\"entryTransition\":{\"type\":\"tween\",\"durationMs\":600,\"easing\":\"ease-out\"},\"transitionMs\":600}}}"
        },
        {
          "type": "TextualBody",
          "value": "Because of the near life-size scale of the figures, it's a painting one wants to just walk into. This is Paris Street; Rainy Day — Gustave Caillebotte's largest painting.",
          "format": "text/plain",
          "language": "en",
          "purpose": "describing"
        }
      ],
      "target": {
        "source": "https://www.artic.edu/iiif/2/f8fd76e9-c396-5678-36ed-6a348c904d27",
        "type": "SpecificResource",
        "partOf": {
          "id": "https://api.artic.edu/api/v1/artworks/20684/manifest.json",
          "type": "Manifest"
        },
        "selector": {
          "type": "FragmentSelector",
          "conformsTo": "http://www.w3.org/TR/media-frags/",
          "value": "xywh=0,0,9987,7755"
        }
      }
    },
    {
      "id": "https://404mike.github.io/uv4-manifest/mango/stories/codex-claude.json/annotation/chapter_2",
      "type": "Annotation",
      "motivation": "supplementing",
      "label": {
        "en": [
          "A frozen film sequence"
        ]
      },
      "summary": {
        "en": [
          "Gloria Groom, curator of European painting and sculpture: think of this almost as a film sequence that has somehow been stopped — the figures frozen mid-frame."
        ]
      },
      "body": [
        {
          "id": "https://404mike.github.io/uv4-manifest/mango/work/media/paris-street-rainy-day.mp3#t=14.13,29.13",
          "type": "Sound",
          "format": "audio/mp3",
          "language": "en"
        },
        {
          "type": "TextualBody",
          "format": "application/vnd.mango.story-state+json",
          "value": "{\"storyVersion\":\"1.0\",\"state\":{\"chapterId\":\"chapter_2\",\"canvasIndex\":0,\"canvasId\":\"https://www.artic.edu/iiif/2/f8fd76e9-c396-5678-36ed-6a348c904d27\",\"viewBox\":{\"x\":0,\"y\":-1348.8575129533676,\"w\":9987,\"h\":10452.715025906735},\"cameraTrack\":{\"durationMs\":14800,\"keyframes\":[{\"id\":\"a\",\"timeMs\":0,\"focus\":{\"x\":537.5669637736556,\"y\":3659.159682172345},\"viewBox\":{\"x\":-77.87840722833175,\"y\":3209.7703977813494,\"w\":1230.8907420039748,\"h\":898.7785687819917},\"layerOpacities\":{},\"dwellMs\":2000},{\"id\":\"b\",\"timeMs\":7400,\"focus\":{\"x\":3860.7598152424935,\"y\":3452.790235277136},\"viewBox\":{\"x\":3118.7748946447336,\"y\":2911.0036069148596,\"w\":1483.9698411955196,\"h\":1083.5732567245532},\"layerOpacities\":{}},{\"id\":\"c\",\"timeMs\":14800,\"focus\":{\"x\":6200,\"y\":3695.5},\"viewBox\":{\"x\":2600,\"y\":900,\"w\":7200,\"h\":5591}}],\"preset\":\"custom\",\"pathType\":\"linear\",\"easing\":\"ease-out\"},\"playback\":{\"entryTransition\":{\"type\":\"tween\",\"durationMs\":600,\"easing\":\"ease-out\"},\"transitionMs\":600}}}"
        },
        {
          "type": "TextualBody",
          "value": "Gloria Groom, curator of European painting and sculpture: think of this almost as a film sequence that has somehow been stopped — the figures frozen mid-frame.",
          "format": "text/plain",
          "language": "en",
          "purpose": "describing"
        }
      ],
      "target": {
        "source": "https://www.artic.edu/iiif/2/f8fd76e9-c396-5678-36ed-6a348c904d27",
        "type": "SpecificResource",
        "partOf": {
          "id": "https://api.artic.edu/api/v1/artworks/20684/manifest.json",
          "type": "Manifest"
        },
        "selector": {
          "type": "FragmentSelector",
          "conformsTo": "http://www.w3.org/TR/media-frags/",
          "value": "xywh=0,0,9987,10453"
        }
      }
    },
    {
      "id": "https://404mike.github.io/uv4-manifest/mango/stories/codex-claude.json/annotation/chapter_3",
      "type": "Annotation",
      "motivation": "supplementing",
      "label": {
        "en": [
          "Many, many figures"
        ]
      },
      "summary": {
        "en": [
          "There are many, many figures in this painting — the camera roams the pedestrians on the left and centre of the scene."
        ]
      },
      "body": [
        {
          "id": "https://404mike.github.io/uv4-manifest/mango/work/media/paris-street-rainy-day.mp3#t=29.13,33.8",
          "type": "Sound",
          "format": "audio/mp3",
          "language": "en"
        },
        {
          "type": "TextualBody",
          "format": "application/vnd.mango.story-state+json",
          "value": "{\"storyVersion\":\"1.0\",\"state\":{\"chapterId\":\"chapter_3\",\"canvasIndex\":0,\"canvasId\":\"https://www.artic.edu/iiif/2/f8fd76e9-c396-5678-36ed-6a348c904d27\",\"viewBox\":{\"x\":0,\"y\":-1348.8575129533676,\"w\":9987,\"h\":10452.715025906735},\"cameraTrack\":{\"durationMs\":8000,\"keyframes\":[],\"preset\":\"custom\",\"pathType\":\"linear\",\"easing\":\"linear\"},\"playback\":{\"entryTransition\":{\"type\":\"tween\",\"durationMs\":600,\"easing\":\"ease-out\"},\"transitionMs\":600}}}"
        },
        {
          "type": "TextualBody",
          "value": "There are many, many figures in this painting — the camera roams the pedestrians on the left and centre of the scene.",
          "format": "text/plain",
          "language": "en",
          "purpose": "describing"
        }
      ],
      "target": {
        "source": "https://www.artic.edu/iiif/2/f8fd76e9-c396-5678-36ed-6a348c904d27",
        "type": "SpecificResource",
        "partOf": {
          "id": "https://api.artic.edu/api/v1/artworks/20684/manifest.json",
          "type": "Manifest"
        },
        "selector": {
          "type": "FragmentSelector",
          "conformsTo": "http://www.w3.org/TR/media-frags/",
          "value": "xywh=0,0,9987,10453"
        }
      }
    },
    {
      "id": "https://404mike.github.io/uv4-manifest/mango/stories/codex-claude.json/annotation/chapter_4",
      "type": "Annotation",
      "motivation": "supplementing",
      "label": {
        "en": [
          "The elegant couple"
        ]
      },
      "summary": {
        "en": [
          "…and our eye is first focused on this amazingly elegant couple."
        ]
      },
      "body": [
        {
          "id": "https://404mike.github.io/uv4-manifest/mango/work/media/paris-street-rainy-day.mp3#t=33.8,39.4",
          "type": "Sound",
          "format": "audio/mp3",
          "language": "en"
        },
        {
          "type": "TextualBody",
          "format": "application/vnd.mango.story-state+json",
          "value": "{\"storyVersion\":\"1.0\",\"state\":{\"chapterId\":\"chapter_4\",\"canvasIndex\":0,\"canvasId\":\"https://www.artic.edu/iiif/2/f8fd76e9-c396-5678-36ed-6a348c904d27\",\"viewBox\":{\"x\":5678.071998701705,\"y\":2737.7563530418192,\"w\":2322.6570091020817,\"h\":1837.183617855335},\"cameraTrack\":{\"durationMs\":5400,\"keyframes\":[{\"id\":\"d9e40b4d-543a-4c43-84ac-1f9653c12504\",\"timeMs\":0,\"focus\":{\"x\":6815.9212408045005,\"y\":3804.7412951320507},\"viewBox\":{\"x\":4980.736774651305,\"y\":2719.1745275851463,\"w\":3670.3689323063923,\"h\":2171.1335350938084},\"layerOpacities\":{}},{\"id\":\"6d4a2776-ce04-43b3-ba68-8160683324a5\",\"timeMs\":5400,\"focus\":{\"x\":6839.400503252747,\"y\":3656.3481619694867},\"viewBox\":{\"x\":5564.966846201915,\"y\":2902.482351173025,\"w\":2548.867314101662,\"h\":1507.7316215929231},\"layerOpacities\":{}}],\"preset\":\"custom\",\"pathType\":\"linear\",\"easing\":\"ease-out\"},\"playback\":{\"entryTransition\":{\"type\":\"cut\",\"durationMs\":1},\"transitionMs\":1}}}"
        },
        {
          "type": "TextualBody",
          "value": "…and our eye is first focused on this amazingly elegant couple.",
          "format": "text/plain",
          "language": "en",
          "purpose": "describing"
        }
      ],
      "target": {
        "source": "https://www.artic.edu/iiif/2/f8fd76e9-c396-5678-36ed-6a348c904d27",
        "type": "SpecificResource",
        "partOf": {
          "id": "https://api.artic.edu/api/v1/artworks/20684/manifest.json",
          "type": "Manifest"
        },
        "selector": {
          "type": "FragmentSelector",
          "conformsTo": "http://www.w3.org/TR/media-frags/",